case_group_id,height_nm,wavelengths_nm,phase_bins_deg,priority,planned_action,reason,estimated_stage
S11_4A1_H600_ALL,600,451;452;453,0;60;120;180;240;300,highest,periodic_single_dimer_jones_extraction,H600 primary fixed-height scout,Stage11-4A1
S11_4A1_H650_ALL,650,451;452;453,0;60;120;180;240;300,highest,periodic_single_dimer_jones_extraction,H650 primary fixed-height scout,Stage11-4A1
S11_4A1_H700_240_300,700,451;452;453,240;300,medium_high,periodic_single_dimer_jones_extraction,H700 priority-bin-only scout,Stage11-4A1
DEFER_H550,550,451;452;453,0;60;120;180;240;300,deferred,no_run,H550 deferred unless H600/H650 fail,Stage11-4A1_deferred
DEFER_H750,750,451;452;453,0;60;120;180;240;300,deferred,no_run,H750 deferred as simulation-only extension,Stage11-4A1_deferred
